Judul,Link,judul_lower_case,remove_html,remove_special_characters,remove_escape_characters,cleaned_space,tokenisasi,remove_stopword_english,remove_stopword_indonesia,data_post_cleaned
Terungkap Biang Kerok Gen Z Terjerat Pinjol & Judi Online,https://finance.detik.com/fintech/d-7470024/terungkap-biang-kerok-gen-z-terjerat-pinjol-judi-online,terungkap biang kerok gen z terjerat pinjol & judi online,terungkap biang kerok gen z terjerat pinjol & judi online,terungkap biang kerok gen z terjerat pinjol  judi online,terungkap biang kerok gen z terjerat pinjol  judi online,terungkap biang kerok gen z terjerat pinjol  judi online,"['terungkap', 'biang', 'kerok', 'gen', 'z', 'terjerat', 'pinjol', 'judi', 'online']","['terungkap', 'biang', 'kerok', 'gen', 'z', 'terjerat', 'pinjol', 'judi', 'online']","['terungkap', 'biang', 'kerok', 'gen', 'z', 'terjerat', 'pinjol', 'judi', 'online']","['terungkap', 'biang', 'kerok', 'gen', 'z', 'terjerat', 'pinjol', 'judi', 'online']"
Survei Ungkap 83% Gen Z Lebih Mementingkan Teman daripada Percintaan,https://wolipop.detik.com/love/d-7497653/survei-ungkap-83-gen-z-lebih-mementingkan-teman-daripada-percintaan,survei ungkap 83% gen z lebih mementingkan teman daripada percintaan,survei ungkap 83% gen z lebih mementingkan teman daripada percintaan,survei ungkap  gen z lebih mementingkan teman daripada percintaan,survei ungkap  gen z lebih mementingkan teman daripada percintaan,survei ungkap  gen z lebih mementingkan teman daripada percintaan,"['survei', 'ungkap', 'gen', 'z', 'lebih', 'mementingkan', 'teman', 'daripada', 'percintaan']","['survei', 'ungkap', 'gen', 'z', 'lebih', 'mementingkan', 'teman', 'daripada', 'percintaan']","['survei', 'gen', 'z', 'mementingkan', 'teman', 'percintaan']","['survei', 'gen', 'z', 'menting', 'teman', 'percintaan']"
Ini Alasan Gen Z Lebih Sering Izin Sakit ketimbang Generasi Sebelumnya,https://www.detik.com/sumut/berita/d-7529060/ini-alasan-gen-z-lebih-sering-izin-sakit-ketimbang-generasi-sebelumnya,ini alasan gen z lebih sering izin sakit ketimbang generasi sebelumnya,ini alasan gen z lebih sering izin sakit ketimbang generasi sebelumnya,ini alasan gen z lebih sering izin sakit ketimbang generasi sebelumnya,ini alasan gen z lebih sering izin sakit ketimbang generasi sebelumnya,ini alasan gen z lebih sering izin sakit ketimbang generasi sebelumnya,"['ini', 'alasan', 'gen', 'z', 'lebih', 'sering', 'izin', 'sakit', 'ketimbang', 'generasi', 'sebelumnya']","['ini', 'alasan', 'gen', 'z', 'lebih', 'sering', 'izin', 'sakit', 'ketimbang', 'generasi', 'sebelumnya']","['alasan', 'gen', 'z', 'izin', 'sakit', 'ketimbang', 'generasi']","['alasan', 'gen', 'z', 'izin', 'sakit', 'ketimbang', 'generasi']"
Gen Z Gerah Birokrasi dan Berpotensi Kerja di Luar Negeri,https://finance.detik.com/berita-ekonomi-bisnis/d-7405053/gen-z-gerah-birokrasi-dan-berpotensi-kerja-di-luar-negeri,gen z gerah birokrasi dan berpotensi kerja di luar negeri,gen z gerah birokrasi dan berpotensi kerja di luar negeri,gen z gerah birokrasi dan berpotensi kerja di luar negeri,gen z gerah birokrasi dan berpotensi kerja di luar negeri,gen z gerah birokrasi dan berpotensi kerja di luar negeri,"['gen', 'z', 'gerah', 'birokrasi', 'dan', 'berpotensi', 'kerja', 'di', 'luar', 'negeri']","['gen', 'z', 'gerah', 'birokrasi', 'dan', 'berpotensi', 'kerja', 'di', 'luar', 'negeri']","['gen', 'z', 'gerah', 'birokrasi', 'berpotensi', 'kerja', 'negeri']","['gen', 'z', 'gerah', 'birokrasi', 'berpotensi', 'kerja', 'negeri']"
Tips & Trik Menyimpan Uang Untuk Gen Z,https://20.detik.com/detik-sore/20241106-241106138/tips-trik-menyimpan-uang-untuk-gen-z,tips & trik menyimpan uang untuk gen z,tips & trik menyimpan uang untuk gen z,tips  trik menyimpan uang untuk gen z,tips  trik menyimpan uang untuk gen z,tips  trik menyimpan uang untuk gen z,"['tips', 'trik', 'menyimpan', 'uang', 'untuk', 'gen', 'z']","['tips', 'trik', 'menyimpan', 'uang', 'untuk', 'gen', 'z']","['tips', 'trik', 'menyimpan', 'uang', 'gen', 'z']","['tips', 'trik', 'nyimpan', 'uang', 'gen', 'z']"
"3.700 Warga Singapura Diprediksi Kena Demensia Dini, Termasuk Gen Z",https://health.detik.com/berita-detikhealth/d-7528292/3-700-warga-singapura-diprediksi-kena-demensia-dini-termasuk-gen-z,"3.700 warga singapura diprediksi kena demensia dini, termasuk gen z","3.700 warga singapura diprediksi kena demensia dini, termasuk gen z", warga singapura diprediksi kena demensia dini termasuk gen z, warga singapura diprediksi kena demensia dini termasuk gen z, warga singapura diprediksi kena demensia dini termasuk gen z,"['warga', 'singapura', 'diprediksi', 'kena', 'demensia', 'dini', 'termasuk', 'gen', 'z']","['warga', 'singapura', 'diprediksi', 'kena', 'demensia', 'dini', 'termasuk', 'gen', 'z']","['warga', 'singapura', 'diprediksi', 'kena', 'demensia', 'gen', 'z']","['warga', 'singapura', 'diprediksi', 'kena', 'demensia', 'gen', 'z']"
"Gen Z Bisa Bantu Dorong Ekonomi RI, Begini Caranya",https://finance.detik.com/berita-ekonomi-bisnis/d-7380097/gen-z-bisa-bantu-dorong-ekonomi-ri-begini-caranya,"gen z bisa bantu dorong ekonomi ri, begini caranya","gen z bisa bantu dorong ekonomi ri, begini caranya",gen z bisa bantu dorong ekonomi ri begini caranya,gen z bisa bantu dorong ekonomi ri begini caranya,gen z bisa bantu dorong ekonomi ri begini caranya,"['gen', 'z', 'bisa', 'bantu', 'dorong', 'ekonomi', 'ri', 'begini', 'caranya']","['gen', 'z', 'bisa', 'bantu', 'dorong', 'ekonomi', 'ri', 'begini', 'caranya']","['gen', 'z', 'bantu', 'dorong', 'ekonomi', 'ri']","['gen', 'z', 'bantu', 'dorong', 'ekonomi', 'ri']"
Pramono Anung Belajar dari Anak untuk Gaet Suara Pemilih Gen Z,https://news.detik.com/pilkada/d-7562180/pramono-anung-belajar-dari-anak-untuk-gaet-suara-pemilih-gen-z,pramono anung belajar dari anak untuk gaet suara pemilih gen z,pramono anung belajar dari anak untuk gaet suara pemilih gen z,pramono anung belajar dari anak untuk gaet suara pemilih gen z,pramono anung belajar dari anak untuk gaet suara pemilih gen z,pramono anung belajar dari anak untuk gaet suara pemilih gen z,"['pramono', 'anung', 'belajar', 'dari', 'anak', 'untuk', 'gaet', 'suara', 'pemilih', 'gen', 'z']","['pramono', 'anung', 'belajar', 'dari', 'anak', 'untuk', 'gaet', 'suara', 'pemilih', 'gen', 'z']","['pramono', 'anung', 'belajar', 'anak', 'gaet', 'suara', 'pemilih', 'gen', 'z']","['pramono', 'anung', 'belajar', 'anak', 'gaet', 'suara', 'pemilih', 'gen', 'z']"
"10 Meme Teknologi Jadul, Mari Kita Buat Gen Z Bingung",https://inet.detik.com/fotoinet/d-7540130/10-meme-teknologi-jadul-mari-kita-buat-gen-z-bingung,"10 meme teknologi jadul, mari kita buat gen z bingung","10 meme teknologi jadul, mari kita buat gen z bingung", meme teknologi jadul mari kita buat gen z bingung, meme teknologi jadul mari kita buat gen z bingung, meme teknologi jadul mari kita buat gen z bingung,"['meme', 'teknologi', 'jadul', 'mari', 'kita', 'buat', 'gen', 'z', 'bingung']","['meme', 'teknologi', 'jadul', 'mari', 'kita', 'buat', 'gen', 'z', 'bingung']","['meme', 'teknologi', 'jadul', 'mari', 'gen', 'z', 'bingung']","['me', 'teknologi', 'jadul', 'mari', 'gen', 'z', 'bingung']"
Saran Guru Besar UI untuk Masalah Pengangguran dari Gen Z,https://www.detik.com/edu/detikpedia/d-7445879/saran-guru-besar-ui-untuk-masalah-pengangguran-dari-gen-z,saran guru besar ui untuk masalah pengangguran dari gen z,saran guru besar ui untuk masalah pengangguran dari gen z,saran guru besar ui untuk masalah pengangguran dari gen z,saran guru besar ui untuk masalah pengangguran dari gen z,saran guru besar ui untuk masalah pengangguran dari gen z,"['saran', 'guru', 'besar', 'ui', 'untuk', 'masalah', 'pengangguran', 'dari', 'gen', 'z']","['saran', 'guru', 'besar', 'ui', 'untuk', 'masalah', 'pengangguran', 'dari', 'gen', 'z']","['saran', 'guru', 'ui', 'pengangguran', 'gen', 'z']","['saran', 'guru', 'ui', 'pengangguran', 'gen', 'z']"
Gen Z di AS Disebut Sulit Beli Rumah dan Investasi,https://finance.detik.com/berita-ekonomi-bisnis/d-7433240/gen-z-di-as-disebut-sulit-beli-rumah-dan-investasi,gen z di as disebut sulit beli rumah dan investasi,gen z di as disebut sulit beli rumah dan investasi,gen z di as disebut sulit beli rumah dan investasi,gen z di as disebut sulit beli rumah dan investasi,gen z di as disebut sulit beli rumah dan investasi,"['gen', 'z', 'di', 'as', 'disebut', 'sulit', 'beli', 'rumah', 'dan', 'investasi']","['gen', 'z', 'di', 'disebut', 'sulit', 'beli', 'rumah', 'dan', 'investasi']","['gen', 'z', 'sulit', 'beli', 'rumah', 'investasi']","['gen', 'z', 'sulit', 'beli', 'rumah', 'investasi']"
Studi: Baby Boomer Jadi Generasi Terkaya Dibandingkan Milenial & Z,https://www.detik.com/edu/detikpedia/d-7635052/studi-baby-boomer-jadi-generasi-terkaya-dibandingkan-milenial-z,studi: baby boomer jadi generasi terkaya dibandingkan milenial & z,studi: baby boomer jadi generasi terkaya dibandingkan milenial & z,studi baby boomer jadi generasi terkaya dibandingkan milenial  z,studi baby boomer jadi generasi terkaya dibandingkan milenial  z,studi baby boomer jadi generasi terkaya dibandingkan milenial  z,"['studi', 'baby', 'boomer', 'jadi', 'generasi', 'terkaya', 'dibandingkan', 'milenial', 'z']","['studi', 'baby', 'boomer', 'jadi', 'generasi', 'terkaya', 'dibandingkan', 'milenial', 'z']","['studi', 'baby', 'boomer', 'generasi', 'terkaya', 'dibandingkan', 'milenial', 'z']","['studi', 'baby', 'boomer', 'generasi', 'terkaya', 'dibanding', 'milenial', 'z']"
"Yang Lain Sibuk Nyari Lowongan Kerja, Gen Z Ini Lolos Jadi Anggota DPR",https://finance.detik.com/berita-ekonomi-bisnis/d-7566280/yang-lain-sibuk-nyari-lowongan-kerja-gen-z-ini-lolos-jadi-anggota-dpr,"yang lain sibuk nyari lowongan kerja, gen z ini lolos jadi anggota dpr","yang lain sibuk nyari lowongan kerja, gen z ini lolos jadi anggota dpr",yang lain sibuk nyari lowongan kerja gen z ini lolos jadi anggota dpr,yang lain sibuk nyari lowongan kerja gen z ini lolos jadi anggota dpr,yang lain sibuk nyari lowongan kerja gen z ini lolos jadi anggota dpr,"['yang', 'lain', 'sibuk', 'nyari', 'lowongan', 'kerja', 'gen', 'z', 'ini', 'lolos', 'jadi', 'anggota', 'dpr']","['yang', 'lain', 'sibuk', 'nyari', 'lowongan', 'kerja', 'gen', 'z', 'ini', 'lolos', 'jadi', 'anggota', 'dpr']","['sibuk', 'nyari', 'lowongan', 'kerja', 'gen', 'z', 'lolos', 'anggota', 'dpr']","['sibuk', 'nyari', 'lowongan', 'kerja', 'gen', 'z', 'lolos', 'anggota', 'dpr']"
Survei: Gen Z Lebih Senang Pergi ke Destinasi Murah dan Punya Teknologi Mutakhir,https://travel.detik.com/travel-news/d-7614799/survei-gen-z-lebih-senang-pergi-ke-destinasi-murah-dan-punya-teknologi-mutakhir,survei: gen z lebih senang pergi ke destinasi murah dan punya teknologi mutakhir,survei: gen z lebih senang pergi ke destinasi murah dan punya teknologi mutakhir,survei gen z lebih senang pergi ke destinasi murah dan punya teknologi mutakhir,survei gen z lebih senang pergi ke destinasi murah dan punya teknologi mutakhir,survei gen z lebih senang pergi ke destinasi murah dan punya teknologi mutakhir,"['survei', 'gen', 'z', 'lebih', 'senang', 'pergi', 'ke', 'destinasi', 'murah', 'dan', 'punya', 'teknologi', 'mutakhir']","['survei', 'gen', 'z', 'lebih', 'senang', 'pergi', 'ke', 'destinasi', 'murah', 'dan', 'punya', 'teknologi', 'mutakhir']","['survei', 'gen', 'z', 'senang', 'pergi', 'destinasi', 'murah', 'teknologi', 'mutakhir']","['survei', 'gen', 'z', 'senang', 'pergi', 'destinasi', 'murah', 'teknologi', 'mutakhir']"
"Tapera di Mata Gen Z, Untung atau Buntung?",https://finance.detik.com/moneter/d-7394504/tapera-di-mata-gen-z-untung-atau-buntung,"tapera di mata gen z, untung atau buntung?","tapera di mata gen z, untung atau buntung?",tapera di mata gen z untung atau buntung,tapera di mata gen z untung atau buntung,tapera di mata gen z untung atau buntung,"['tapera', 'di', 'mata', 'gen', 'z', 'untung', 'atau', 'buntung']","['tapera', 'di', 'mata', 'gen', 'z', 'untung', 'atau', 'buntung']","['tapera', 'mata', 'gen', 'z', 'untung', 'buntung']","['tapera', 'mata', 'gen', 'z', 'untung', 'buntung']"
"Teruntuk Gen Z, Ini Caranya Biar Nggak Dicap Generasi Lembek",https://health.detik.com/detiktv/d-7388606/teruntuk-gen-z-ini-caranya-biar-nggak-dicap-generasi-lembek,"teruntuk gen z, ini caranya biar nggak dicap generasi lembek","teruntuk gen z, ini caranya biar nggak dicap generasi lembek",teruntuk gen z ini caranya biar nggak dicap generasi lembek,teruntuk gen z ini caranya biar nggak dicap generasi lembek,teruntuk gen z ini caranya biar nggak dicap generasi lembek,"['teruntuk', 'gen', 'z', 'ini', 'caranya', 'biar', 'nggak', 'dicap', 'generasi', 'lembek']","['teruntuk', 'gen', 'z', 'ini', 'caranya', 'biar', 'nggak', 'dicap', 'generasi', 'lembek']","['teruntuk', 'gen', 'z', 'biar', 'nggak', 'dicap', 'generasi', 'lembek']","['teruntuk', 'gen', 'z', 'biar', 'nggak', 'dicap', 'generasi', 'lembek']"
Video: Pramono Ingin Hadirkan Hunian 'Ramah' Gen Z-Generasi Sandwich,https://20.detik.com/detikupdate/20241106-241106119/video-pramono-ingin-hadirkan-hunian-ramah-gen-z-generasi-sandwich,video: pramono ingin hadirkan hunian 'ramah' gen z-generasi sandwich,video: pramono ingin hadirkan hunian 'ramah' gen z-generasi sandwich,video pramono ingin hadirkan hunian ramah gen zgenerasi sandwich,video pramono ingin hadirkan hunian ramah gen zgenerasi sandwich,video pramono ingin hadirkan hunian ramah gen zgenerasi sandwich,"['video', 'pramono', 'ingin', 'hadirkan', 'hunian', 'ramah', 'gen', 'zgenerasi', 'sandwich']","['video', 'pramono', 'ingin', 'hadirkan', 'hunian', 'ramah', 'gen', 'zgenerasi', 'sandwich']","['video', 'pramono', 'hadirkan', 'hunian', 'ramah', 'gen', 'zgenerasi', 'sandwich']","['video', 'pramono', 'hadir', 'hunian', 'ramah', 'gen', 'zgenerasi', 'sandwich']"
Kata Psikolog soal Stigma Gen Z Dicap Lemah,https://health.detik.com/detiktv/d-7388203/kata-psikolog-soal-stigma-gen-z-dicap-lemah,kata psikolog soal stigma gen z dicap lemah,kata psikolog soal stigma gen z dicap lemah,kata psikolog soal stigma gen z dicap lemah,kata psikolog soal stigma gen z dicap lemah,kata psikolog soal stigma gen z dicap lemah,"['kata', 'psikolog', 'soal', 'stigma', 'gen', 'z', 'dicap', 'lemah']","['kata', 'psikolog', 'soal', 'stigma', 'gen', 'z', 'dicap', 'lemah']","['psikolog', 'stigma', 'gen', 'z', 'dicap', 'lemah']","['psikolog', 'stigma', 'gen', 'z', 'dicap', 'lemah']"
Banyak Gen Z Terjerat Pinjol karena Gaya Hidup,https://www.detik.com/jabar/bisnis/d-7458608/banyak-gen-z-terjerat-pinjol-karena-gaya-hidup,banyak gen z terjerat pinjol karena gaya hidup,banyak gen z terjerat pinjol karena gaya hidup,banyak gen z terjerat pinjol karena gaya hidup,banyak gen z terjerat pinjol karena gaya hidup,banyak gen z terjerat pinjol karena gaya hidup,"['banyak', 'gen', 'z', 'terjerat', 'pinjol', 'karena', 'gaya', 'hidup']","['banyak', 'gen', 'z', 'terjerat', 'pinjol', 'karena', 'gaya', 'hidup']","['gen', 'z', 'terjerat', 'pinjol', 'gaya', 'hidup']","['gen', 'z', 'terjerat', 'pinjol', 'gaya', 'hidup']"
Cerita Gen Z di Cirebon Kesusahan Cari Kerja,https://www.detik.com/jabar/cirebon-raya/d-7458050/cerita-gen-z-di-cirebon-kesusahan-cari-kerja,cerita gen z di cirebon kesusahan cari kerja,cerita gen z di cirebon kesusahan cari kerja,cerita gen z di cirebon kesusahan cari kerja,cerita gen z di cirebon kesusahan cari kerja,cerita gen z di cirebon kesusahan cari kerja,"['cerita', 'gen', 'z', 'di', 'cirebon', 'kesusahan', 'cari', 'kerja']","['cerita', 'gen', 'z', 'di', 'cirebon', 'kesusahan', 'cari', 'kerja']","['cerita', 'gen', 'z', 'cirebon', 'kesusahan', 'cari', 'kerja']","['cerita', 'gen', 'z', 'cirebon', 'kesusahan', 'cari', 'kerja']"
Potret Gen Z Asyik Nge-date di Perpustakaan Jakarta,https://travel.detik.com/fototravel/d-7438870/potret-gen-z-asyik-nge-date-di-perpustakaan-jakarta,potret gen z asyik nge-date di perpustakaan jakarta,potret gen z asyik nge-date di perpustakaan jakarta,potret gen z asyik ngedate di perpustakaan jakarta,potret gen z asyik ngedate di perpustakaan jakarta,potret gen z asyik ngedate di perpustakaan jakarta,"['potret', 'gen', 'z', 'asyik', 'ngedate', 'di', 'perpustakaan', 'jakarta']","['potret', 'gen', 'z', 'asyik', 'ngedate', 'di', 'perpustakaan', 'jakarta']","['potret', 'gen', 'z', 'asyik', 'ngedate', 'perpustakaan', 'jakarta']","['potret', 'gen', 'z', 'asyik', 'ngedate', 'perpustakaan', 'jakarta']"
"Gen Z Amerika Tinggalkan Smartphone Pilih HP Jadul, Kok Bisa?",https://www.detik.com/edu/detikpedia/d-7376244/gen-z-amerika-tinggalkan-smartphone-pilih-hp-jadul-kok-bisa,"gen z amerika tinggalkan smartphone pilih hp jadul, kok bisa?","gen z amerika tinggalkan smartphone pilih hp jadul, kok bisa?",gen z amerika tinggalkan smartphone pilih hp jadul kok bisa,gen z amerika tinggalkan smartphone pilih hp jadul kok bisa,gen z amerika tinggalkan smartphone pilih hp jadul kok bisa,"['gen', 'z', 'amerika', 'tinggalkan', 'smartphone', 'pilih', 'hp', 'jadul', 'kok', 'bisa']","['gen', 'z', 'amerika', 'tinggalkan', 'smartphone', 'pilih', 'hp', 'jadul', 'kok', 'bisa']","['gen', 'z', 'amerika', 'tinggalkan', 'smartphone', 'pilih', 'hp', 'jadul']","['gen', 'z', 'amerika', 'tinggal', 'smartphone', 'pilih', 'hp', 'jadul']"
"Tapera di Mata Gen Z, Untung atau Buntung?",https://finance.detik.com/moneter/d-7394119/tapera-di-mata-gen-z-untung-atau-buntung,"tapera di mata gen z, untung atau buntung?","tapera di mata gen z, untung atau buntung?",tapera di mata gen z untung atau buntung,tapera di mata gen z untung atau buntung,tapera di mata gen z untung atau buntung,"['tapera', 'di', 'mata', 'gen', 'z', 'untung', 'atau', 'buntung']","['tapera', 'di', 'mata', 'gen', 'z', 'untung', 'atau', 'buntung']","['tapera', 'mata', 'gen', 'z', 'untung', 'buntung']","['tapera', 'mata', 'gen', 'z', 'untung', 'buntung']"
"Gen Z Lebih Sering Izin Sakit daripada Generasi Sebelumnya, Ini Alasannya",https://wolipop.detik.com/worklife/d-7528086/gen-z-lebih-sering-izin-sakit-daripada-generasi-sebelumnya-ini-alasannya,"gen z lebih sering izin sakit daripada generasi sebelumnya, ini alasannya","gen z lebih sering izin sakit daripada generasi sebelumnya, ini alasannya",gen z lebih sering izin sakit daripada generasi sebelumnya ini alasannya,gen z lebih sering izin sakit daripada generasi sebelumnya ini alasannya,gen z lebih sering izin sakit daripada generasi sebelumnya ini alasannya,"['gen', 'z', 'lebih', 'sering', 'izin', 'sakit', 'daripada', 'generasi', 'sebelumnya', 'ini', 'alasannya']","['gen', 'z', 'lebih', 'sering', 'izin', 'sakit', 'daripada', 'generasi', 'sebelumnya', 'ini', 'alasannya']","['gen', 'z', 'izin', 'sakit', 'generasi', 'alasannya']","['gen', 'z', 'izin', 'sakit', 'generasi', 'alasannya']"
Ini Alasan Mengapa Gen Z Suka Makan 'Lumut Laut',https://food.detik.com/info-kuliner/d-7441784/ini-alasan-mengapa-gen-z-suka-makan-lumut-laut,ini alasan mengapa gen z suka makan 'lumut laut',ini alasan mengapa gen z suka makan 'lumut laut',ini alasan mengapa gen z suka makan lumut laut,ini alasan mengapa gen z suka makan lumut laut,ini alasan mengapa gen z suka makan lumut laut,"['ini', 'alasan', 'mengapa', 'gen', 'z', 'suka', 'makan', 'lumut', 'laut']","['ini', 'alasan', 'mengapa', 'gen', 'z', 'suka', 'makan', 'lumut', 'laut']","['alasan', 'gen', 'z', 'suka', 'makan', 'lumut', 'laut']","['alasan', 'gen', 'z', 'suka', 'ma', 'lumut', 'laut']"
Marina Beauty Journey 2024 Ajak Gen Z Cintai Budaya Lokal,https://wolipop.detik.com/entertainment-news/d-7372816/marina-beauty-journey-2024-ajak-gen-z-cintai-budaya-lokal,marina beauty journey 2024 ajak gen z cintai budaya lokal,marina beauty journey 2024 ajak gen z cintai budaya lokal,marina beauty journey  ajak gen z cintai budaya lokal,marina beauty journey  ajak gen z cintai budaya lokal,marina beauty journey  ajak gen z cintai budaya lokal,"['marina', 'beauty', 'journey', 'ajak', 'gen', 'z', 'cintai', 'budaya', 'lokal']","['marina', 'beauty', 'journey', 'ajak', 'gen', 'z', 'cintai', 'budaya', 'lokal']","['marina', 'beauty', 'journey', 'ajak', 'gen', 'z', 'cintai', 'budaya', 'lokal']","['marina', 'beauty', 'journey', 'ajak', 'gen', 'z', 'cintai', 'budaya', 'lokal']"
Wabup Klaten Ingatkan Gen Z dan Milenial Jangan Lupakan Sejarah,https://www.detik.com/jateng/berita/d-7415014/wabup-klaten-ingatkan-gen-z-dan-milenial-jangan-lupakan-sejarah,wabup klaten ingatkan gen z dan milenial jangan lupakan sejarah,wabup klaten ingatkan gen z dan milenial jangan lupakan sejarah,wabup klaten ingatkan gen z dan milenial jangan lupakan sejarah,wabup klaten ingatkan gen z dan milenial jangan lupakan sejarah,wabup klaten ingatkan gen z dan milenial jangan lupakan sejarah,"['wabup', 'klaten', 'ingatkan', 'gen', 'z', 'dan', 'milenial', 'jangan', 'lupakan', 'sejarah']","['wabup', 'klaten', 'ingatkan', 'gen', 'z', 'dan', 'milenial', 'jangan', 'lupakan', 'sejarah']","['wabup', 'klaten', 'ingatkan', 'gen', 'z', 'milenial', 'lupakan', 'sejarah']","['wabup', 'klaten', 'ingat', 'gen', 'z', 'milenial', 'lupa', 'sejarah']"
Negara Wajib Peduli Masa Depan dan Tantangan Gen-Z,https://news.detik.com/kolom/d-7368450/negara-wajib-peduli-masa-depan-dan-tantangan-gen-z,negara wajib peduli masa depan dan tantangan gen-z,negara wajib peduli masa depan dan tantangan gen-z,negara wajib peduli masa depan dan tantangan genz,negara wajib peduli masa depan dan tantangan genz,negara wajib peduli masa depan dan tantangan genz,"['negara', 'wajib', 'peduli', 'masa', 'depan', 'dan', 'tantangan', 'genz']","['negara', 'wajib', 'peduli', 'masa', 'depan', 'dan', 'tantangan', 'genz']","['negara', 'wajib', 'peduli', 'tantangan', 'genz']","['negara', 'wajib', 'peduli', 'tantangan', 'genz']"
Solusi Investasi Masalah Klasik Antara Beli atau Sewa Rumah,https://20.detik.com/detik-sore/20241023-241023126/solusi-investasi-masalah-klasik-antara-beli-atau-sewa-rumah,solusi investasi masalah klasik antara beli atau sewa rumah,solusi investasi masalah klasik antara beli atau sewa rumah,solusi investasi masalah klasik antara beli atau sewa rumah,solusi investasi masalah klasik antara beli atau sewa rumah,solusi investasi masalah klasik antara beli atau sewa rumah,"['solusi', 'investasi', 'masalah', 'klasik', 'antara', 'beli', 'atau', 'sewa', 'rumah']","['solusi', 'investasi', 'masalah', 'klasik', 'antara', 'beli', 'atau', 'sewa', 'rumah']","['solusi', 'investasi', 'klasik', 'beli', 'sewa', 'rumah']","['solusi', 'investasi', 'klasik', 'beli', 'sewa', 'rumah']"
Arti Bahasa Gaul Ege yang Viral dan Banyak Digunakan Gen Z,https://wolipop.detik.com/entertainment-news/d-7566142/arti-bahasa-gaul-ege-yang-viral-dan-banyak-digunakan-gen-z,arti bahasa gaul ege yang viral dan banyak digunakan gen z,arti bahasa gaul ege yang viral dan banyak digunakan gen z,arti bahasa gaul ege yang viral dan banyak digunakan gen z,arti bahasa gaul ege yang viral dan banyak digunakan gen z,arti bahasa gaul ege yang viral dan banyak digunakan gen z,"['arti', 'bahasa', 'gaul', 'ege', 'yang', 'viral', 'dan', 'banyak', 'digunakan', 'gen', 'z']","['arti', 'bahasa', 'gaul', 'ege', 'yang', 'viral', 'dan', 'banyak', 'digunakan', 'gen', 'z']","['arti', 'bahasa', 'gaul', 'ege', 'viral', 'gen', 'z']","['arti', 'bahasa', 'gaul', 'ege', 'viral', 'gen', 'z']"
"Rano Karno soal Live TikTok Raih Suara Gen Z: Kite Malu, Umur Udah Tua",https://news.detik.com/detiktv/d-7539453/rano-karno-soal-live-tiktok-raih-suara-gen-z-kite-malu-umur-udah-tua,"rano karno soal live tiktok raih suara gen z: kite malu, umur udah tua","rano karno soal live tiktok raih suara gen z: kite malu, umur udah tua",rano karno soal live tiktok raih suara gen z kite malu umur udah tua,rano karno soal live tiktok raih suara gen z kite malu umur udah tua,rano karno soal live tiktok raih suara gen z kite malu umur udah tua,"['rano', 'karno', 'soal', 'live', 'tiktok', 'raih', 'suara', 'gen', 'z', 'kite', 'malu', 'umur', 'udah', 'tua']","['rano', 'karno', 'soal', 'live', 'tiktok', 'raih', 'suara', 'gen', 'z', 'kite', 'malu', 'umur', 'udah', 'tua']","['rano', 'karno', 'live', 'tiktok', 'raih', 'suara', 'gen', 'z', 'kite', 'malu', 'umur', 'udah', 'tua']","['rano', 'karno', 'live', 'tiktok', 'raih', 'suara', 'gen', 'z', 'kite', 'malu', 'umur', 'udah', 'tua']"
Beberapa Alasan Kenapa Apartemen Cocok Buat Milenial-Gen Z,https://www.detik.com/properti/berita/d-7369717/beberapa-alasan-kenapa-apartemen-cocok-buat-milenial-gen-z,beberapa alasan kenapa apartemen cocok buat milenial-gen z,beberapa alasan kenapa apartemen cocok buat milenial-gen z,beberapa alasan kenapa apartemen cocok buat milenialgen z,beberapa alasan kenapa apartemen cocok buat milenialgen z,beberapa alasan kenapa apartemen cocok buat milenialgen z,"['beberapa', 'alasan', 'kenapa', 'apartemen', 'cocok', 'buat', 'milenialgen', 'z']","['beberapa', 'alasan', 'kenapa', 'apartemen', 'cocok', 'buat', 'milenialgen', 'z']","['alasan', 'apartemen', 'cocok', 'milenialgen', 'z']","['alasan', 'apartemen', 'cocok', 'milenialgen', 'z']"
"Adu Gaya WAGs Tenis di Wimbledon 2024, Didominasi Influencer Gen Z",https://wolipop.detik.com/celeb-style/d-7433704/adu-gaya-wags-tenis-di-wimbledon-2024-didominasi-influencer-gen-z,"adu gaya wags tenis di wimbledon 2024, didominasi influencer gen z","adu gaya wags tenis di wimbledon 2024, didominasi influencer gen z",adu gaya wags tenis di wimbledon  didominasi influencer gen z,adu gaya wags tenis di wimbledon  didominasi influencer gen z,adu gaya wags tenis di wimbledon  didominasi influencer gen z,"['adu', 'gaya', 'wags', 'tenis', 'di', 'wimbledon', 'didominasi', 'influencer', 'gen', 'z']","['adu', 'gaya', 'wags', 'tenis', 'di', 'wimbledon', 'didominasi', 'influencer', 'gen', 'z']","['adu', 'gaya', 'wags', 'tenis', 'wimbledon', 'didominasi', 'influencer', 'gen', 'z']","['adu', 'gaya', 'wags', 'tenis', 'wimbledon', 'didominasi', 'influencer', 'gen', 'z']"
